{
  "v": "ACDCCAACAAJSONAAUB.",
  "t": "acm",
  "d": "EBXbwk1trQqckUSiZfnnGxAGu10DC9nrIAvy7660jbfN",
  "i": "EMRlhEQK44_V5804rsRvQ99Gtf7uDpYQqZuvrw0LhV3S",
  "rd": "EKfi58Jiv-NVqr6GOrxgxzhrE5RsDaH4QNwv9rCyZCwZ",
  "s": "EHReayB8hE1jqYEr418Hxh_najdMS8UExEG4G6Ris3MO",
  "a": {
    "dt": "2026-09-15T14:23:16.000000+00:00",
    "validFrom": "2026-09-15T14:23:16.000000+00:00",
    "coc": "EMwE-XevWy8DkCf2oXSsDRjAUuQOXeuVSdKx8BRpCH-g"
  },
  "r": {
    "d": "EJaMEDp0_WMMVV-32nQAR4qVWJqcc7SeIFXoHp5lhEKs",
    "commitmentNotCompliance": "The issuer declares an intention to abide by the named code of conduct. This credential is not evidence that the issuer has abided by it, and a verifier MUST NOT read compliance, audit or enforcement into a declaration of intent.",
    "referencedCodeMayChange": "Where coc holds an ordinary URL rather than a SAID or a data URL, the issuer commits to whatever is published at that location, which can change after issuance. A verifier relying on such a declaration MUST fetch the code of conduct and judge it for itself, and MUST NOT assume the content it sees is the content the issuer saw.",
    "selfAsserted": "This is a self-issued public declaration, not a credential granted by a third party. It carries no vetting, and whatever weight it has comes from the issuer being publicly accountable for having made it."
  }
}
